[
  {
    "id": 1,
    "slug": "qualitative-ux-research",
    "Specialization Name": "Qualitative UX Research",
    "Data Type": [
      {
        "slug": "job-specialization",
        "label": "Job Specialization"
      }
    ],
    "What Makes This Specialization Unique?": "What makes this specialization unique is its focus on understanding people's emotions and experiences, rather than just numbers and data. Unlike other research roles that might focus on statistics, Qualitative UX Research is all about the stories and feelings behind user interactions. It's like being a storyteller who helps design better products by understanding what users truly need and want.",
    "Tech Job Category": "User Experience",
    "Related Tech Fleet Positions": [
      {
        "slug": "ux-researcher",
        "label": "UX Researcher"
      },
      {
        "slug": "product-designer",
        "label": "Product Designer"
      }
    ],
    "Roles": "UX (User Experience) Researcher",
    "Specialization Tasks": [
      {
        "slug": "analyzing-research-findings",
        "label": "Analyzing Research Findings"
      },
      {
        "slug": "presenting-research-results",
        "label": "Presenting Research Results"
      },
      {
        "slug": "moderating-ux-research",
        "label": "Moderating UX Research"
      },
      {
        "slug": "secondary-research",
        "label": "Secondary Research"
      },
      {
        "slug": "card-sorting",
        "label": "Card Sorting "
      },
      {
        "slug": "interviewing",
        "label": "Interviewing"
      },
      {
        "slug": "diary-studies",
        "label": "Diary Studies"
      },
      {
        "slug": "contextual-inquiries",
        "label": "Contextual Inquiries"
      },
      {
        "slug": "observing-ethnography",
        "label": "Observing (Ethnography)"
      },
      {
        "slug": "usability-testing",
        "label": "Usability Testing"
      },
      {
        "slug": "prototype-concept-testing",
        "label": "Prototype Concept Testing "
      },
      {
        "slug": "a-b-prototype-test-creation",
        "label": "A/B Prototype Test Creation"
      },
      {
        "slug": "user-acceptance-testing",
        "label": "User Acceptance Testing"
      },
      {
        "slug": "facilitating-agile-workshops",
        "label": "Facilitating Agile Workshops"
      },
      {
        "slug": "identifying-research-patterns",
        "label": "Identifying Research Patterns"
      },
      {
        "slug": "experiment-design",
        "label": "Experiment Design"
      },
      {
        "slug": "creating-research-plans",
        "label": "Creating Research Plans"
      },
      {
        "slug": "choosing-research-methods",
        "label": "Choosing Research Methods"
      }
    ],
    "Project Types": [
      {
        "slug": "website-project",
        "label": "Website Project"
      },
      {
        "slug": "web-application-project",
        "label": "Web Application Project"
      },
      {
        "slug": "mobile-app-project",
        "label": "Mobile App Project"
      },
      {
        "slug": "service-design-project",
        "label": "Service Design Project"
      },
      {
        "slug": "discovery-project",
        "label": "Discovery Project"
      }
    ]
  },
  {
    "id": 2,
    "slug": "interaction-design",
    "Specialization Name": "Interaction Design",
    "Data Type": [
      {
        "slug": "job-specialization",
        "label": "Job Specialization"
      }
    ],
    "What Makes This Specialization Unique?": "What makes Interaction Design special is its focus on how people interact with technology. Unlike other design fields that might focus more on how things look, Interaction Design is all about making sure things are easy and fun to use. It's like being a detective, figuring out what users need and how to make their experience as smooth as possible. You'll be the bridge between technology and people, ensuring that digital products are not just functional but also enjoyable.",
    "Tech Job Category": "User Experience",
    "Related Tech Fleet Positions": [
      {
        "slug": "ux-designer",
        "label": "UX Designer"
      },
      {
        "slug": "ui-designer",
        "label": "UI Designer"
      }
    ],
    "Roles": "UX (User Experience) Designer",
    "Specialization Tasks": [
      {
        "slug": "wireframing",
        "label": "Wireframing"
      },
      {
        "slug": "storyboarding",
        "label": "Storyboarding"
      },
      {
        "slug": "prototype-creation",
        "label": "Prototype Creation"
      },
      {
        "slug": "facilitating-agile-workshops",
        "label": "Facilitating Agile Workshops"
      },
      {
        "slug": "clickable-prototype-creation",
        "label": "Clickable Prototype Creation"
      }
    ],
    "Project Types": [
      {
        "slug": "website-project",
        "label": "Website Project"
      },
      {
        "slug": "web-application-project",
        "label": "Web Application Project"
      },
      {
        "slug": "mobile-app-project",
        "label": "Mobile App Project"
      }
    ]
  },
  {
    "id": 3,
    "slug": "information-architecture",
    "Specialization Name": "Information Architecture",
    "Data Type": [
      {
        "slug": "job-specialization",
        "label": "Job Specialization"
      }
    ],
    "What Makes This Specialization Unique?": "What makes Information Architecture unique is its focus on making information easy to find and use, unlike other specializations that might focus more on how things look or function. It's like being the mastermind behind a treasure map, ensuring everyone can find the treasure (or information) they're looking for without getting lost.",
    "Tech Job Category": "User Experience",
    "Related Tech Fleet Positions": [
      {
        "slug": "ux-designer",
        "label": "UX Designer"
      },
      {
        "slug": "ui-designer",
        "label": "UI Designer"
      }
    ],
    "Roles": "UX (User Experience) Designer",
    "Specialization Tasks": [
      {
        "slug": "card-sorting",
        "label": "Card Sorting "
      },
      {
        "slug": "facilitating-agile-workshops",
        "label": "Facilitating Agile Workshops"
      },
      {
        "slug": "inventorying-content",
        "label": "Inventorying Content"
      },
      {
        "slug": "site-map-testing",
        "label": "Site Map Testing"
      }
    ],
    "Project Types": [
      {
        "slug": "website-project",
        "label": "Website Project"
      },
      {
        "slug": "web-application-project",
        "label": "Web Application Project"
      },
      {
        "slug": "mobile-app-project",
        "label": "Mobile App Project"
      }
    ]
  },
  {
    "id": 4,
    "slug": "content-strategy",
    "Specialization Name": "Content Strategy",
    "Data Type": [
      {
        "slug": "job-specialization",
        "label": "Job Specialization"
      }
    ],
    "What Makes This Specialization Unique?": "What makes content strategy special is that it's not just about creating content; it's about making sure the content connects with the right people and serves a purpose. Unlike other roles that might focus only on writing or design, content strategists look at the big picture. They figure out what the audience needs and how to deliver it in the best way possible, making sure every piece of content has a clear goal and fits into a larger plan.",
    "Tech Job Category": "User Experience",
    "Related Tech Fleet Positions": [
      {
        "slug": "ux-writer",
        "label": "UX Writer"
      }
    ],
    "Roles": "UX (User Experience) Writer",
    "Specialization Tasks": [
      {
        "slug": "strategy-definition",
        "label": "Strategy Definition"
      },
      {
        "slug": "card-sorting",
        "label": "Card Sorting "
      },
      {
        "slug": "facilitating-agile-workshops",
        "label": "Facilitating Agile Workshops"
      },
      {
        "slug": "inventorying-content",
        "label": "Inventorying Content"
      },
      {
        "slug": "copywriting",
        "label": "Copywriting"
      }
    ],
    "Project Types": [
      {
        "slug": "website-project",
        "label": "Website Project"
      }
    ]
  },
  {
    "id": 5,
    "slug": "service-design",
    "Specialization Name": "Service Design",
    "Data Type": [
      {
        "slug": "job-specialization",
        "label": "Job Specialization"
      }
    ],
    "What Makes This Specialization Unique?": "What makes Service Design unique is its focus on the big picture. Unlike other specializations that might focus on just one part of a service, Service Design looks at the entire journey a customer takes. It's like being a director of a movie, making sure every scene fits together to tell a great story. You'll work with different teams and use your imagination to create services that people love and find easy to use.",
    "Tech Job Category": "User Experience",
    "Related Tech Fleet Positions": [
      {
        "slug": "ux-designer",
        "label": "UX Designer"
      },
      {
        "slug": "ui-designer",
        "label": "UI Designer"
      }
    ],
    "Roles": "UX (User Experience) Designer",
    "Specialization Tasks": [
      {
        "slug": "strategy-definition",
        "label": "Strategy Definition"
      },
      {
        "slug": "storyboarding",
        "label": "Storyboarding"
      },
      {
        "slug": "customer-segmentation",
        "label": "Customer Segmentation"
      },
      {
        "slug": "customer-experience-mapping",
        "label": "Customer Experience Mapping"
      }
    ],
    "Project Types": [
      {
        "slug": "service-design-project",
        "label": "Service Design Project"
      }
    ]
  },
  {
    "id": 6,
    "slug": "customer-experience-design",